{
  "manifestVersion": 1,
  "workerId": "sf3d",
  "displayName": "Stable Fast 3D",
  "status": "NotInstalled",
  "packageVersion": "0.0.0",
  "licenseId": "stability-community",
  "licenseRef": "docs/audit/STAGE13_SF3D_SPAR3D_DECISION.md",
  "includedInBaseInstaller": false,
  "model": {
    "checkpointHash": null,
    "sizeBytes": 0,
    "verified": false
  },
  "releasePackage": {
    "format": "zip",
    "downloadUrl": null,
    "sha256": null
  },
  "requirements": {
    "minVramMb": 8192,
    "requiresCuda": true,
    "requiresUv": false,
    "requiresBlender": false,
    "notes": "REJECTED for product install this cycle. Manifest retained for honest probing only."
  }
}
