{
  "manifestVersion": 1,
  "workerId": "triposr",
  "displayName": "TripoSR Image-to-3D",
  "status": "NotInstalled",
  "packageVersion": "0.0.0",
  "licenseId": "mit",
  "licenseRef": "docs/audit/PHASE_26_REPORT.md",
  "includedInBaseInstaller": false,
  "model": {
    "checkpointHash": null,
    "sizeBytes": 0,
    "verified": false
  },
  "releasePackage": {
    "format": "zip",
    "downloadUrl": null,
    "sha256": null
  },
  "requirements": {
    "minVramMb": 0,
    "requiresCuda": false,
    "requiresUv": false,
    "requiresBlender": false,
    "notes": "NotInstalled until ModelManager package with verified checkpoint exists."
  }
}
