{
  "manifestVersion": 1,
  "workerId": "skintokens",
  "displayName": "SkinTokens Rig Backend",
  "status": "NotInstalled",
  "packageVersion": "0.0.0",
  "licenseId": "pending-review",
  "licenseRef": "docs/audit/STAGE16_SKINTOKENS_DECISION.md",
  "includedInBaseInstaller": false,
  "model": {
    "checkpointHash": null,
    "sizeBytes": 0,
    "verified": false
  },
  "releasePackage": {
    "format": "zip",
    "downloadUrl": null,
    "sha256": null
  },
  "requirements": {
    "minVramMb": 8192,
    "requiresCuda": true,
    "requiresUv": false,
    "requiresBlender": false,
    "notes": "DO NOT INTEGRATE – license/provenance/VRAM not cleared (Stage 16)."
  }
}
