{
  "manifestVersion": 1,
  "workerId": "qwen",
  "displayName": "Qwen Reference Image Backend",
  "status": "NotInstalled",
  "packageVersion": "0.0.0",
  "licenseId": "qwen",
  "licenseRef": "docs/research/LOCAL_AI_EDIT_DECISION.md",
  "includedInBaseInstaller": false,
  "model": {
    "checkpointHash": null,
    "sizeBytes": 0,
    "verified": false
  },
  "releasePackage": {
    "format": "zip",
    "downloadUrl": null,
    "sha256": null
  },
  "requirements": {
    "minVramMb": 8192,
    "requiresCuda": true,
    "requiresUv": false,
    "requiresBlender": false,
    "notes": "Checkpoint installed via ModelManager. Not bundled."
  }
}
