{
  "manifestVersion": 1,
  "workerId": "flux",
  "displayName": "FLUX.1-schnell Reference Image Backend",
  "status": "NotInstalled",
  "packageVersion": "0.0.0",
  "licenseId": "apache-2.0",
  "licenseRef": "docs/research/LOCAL_AI_EDIT_DECISION.md",
  "includedInBaseInstaller": false,
  "model": {
    "checkpointHash": null,
    "sizeBytes": 0,
    "verified": false
  },
  "releasePackage": {
    "format": "zip",
    "downloadUrl": null,
    "sha256": null
  },
  "requirements": {
    "minVramMb": 8192,
    "requiresCuda": true,
    "requiresUv": false,
    "requiresBlender": false,
    "notes": "Only FLUX.1-schnell (Apache-2.0) is eligible. Non-commercial FLUX variants are forbidden. GATED_MODEL until pinned checkpoint ZIP+SHA exists."
  }
}
